{
  "digest_schema_version": "0.3.0",
  "digest_id": "DIGEST-FIXTURE-POLICY-001-v1",
  "status": "draft",
  "generated_at": "2026-08-26T09:40:00+08:00",
  "supersedes": null,
  "superseded_by": null,
  "source_index_ref": "source-index.json",
  "document_identity": {
    "doc_id": "FIXTURE-POLICY-001",
    "title": "脱敏占位文本-0001",
    "doc_number": "脱敏占位文本-0071",
    "version": "v1",
    "policy_level": "脱敏占位文本-0072",
    "drafting_department": "脱敏占位文本-0073",
    "owning_department": "脱敏占位文本-0073",
    "approving_authority": "脱敏占位文本-0074",
    "publication_date": "2025-01-01",
    "effective_date": "2025-01-01",
    "applicability_summary": "脱敏占位文本-0075",
    "higher_authorities": [],
    "related_documents": [
      "脱敏占位文本-0076"
    ],
    "superseded_documents": [],
    "attachments": [
      "脱敏占位文本-0077",
      "脱敏占位文本-0078"
    ],
    "interpretation_authority": "脱敏占位文本-0073",
    "validity": "effective",
    "source": {
      "doc_id": "FIXTURE-POLICY-001",
      "block_id": "b-000",
      "block_path": "preamble",
      "clause_ref": null,
      "page_hint": 1,
      "excerpt": "脱敏占位文本-0003"
    }
  },
  "scope": {
    "subjects": [
      "脱敏占位文本-0079",
      "脱敏占位文本-0080",
      "脱敏占位文本-0081",
      "脱敏占位文本-0082",
      "脱敏占位文本-0083",
      "脱敏占位文本-0084",
      "脱敏占位文本-0085",
      "脱敏占位文本-0086",
      "脱敏占位文本-0087"
    ],
    "scenarios": [
      "脱敏占位文本-0088",
      "脱敏占位文本-0089",
      "脱敏占位文本-0090",
      "脱敏占位文本-0091",
      "脱敏占位文本-0092",
      "脱敏占位文本-0093",
      "脱敏占位文本-0094"
    ],
    "matters": [
      "脱敏占位文本-0095",
      "脱敏占位文本-0096",
      "脱敏占位文本-0097",
      "脱敏占位文本-0098",
      "脱敏占位文本-0099",
      "脱敏占位文本-0100",
      "脱敏占位文本-0101",
      "脱敏占位文本-0102"
    ],
    "triggers": [
      "脱敏占位文本-0103",
      "脱敏占位文本-0104",
      "脱敏占位文本-0105",
      "脱敏占位文本-0106",
      "脱敏占位文本-0107",
      "脱敏占位文本-0108"
    ],
    "exclusions": [
      "脱敏占位文本-0109",
      "脱敏占位文本-0110"
    ]
  },
  "rules": [
    {
      "rule_id": "R-01",
      "source": {
        "doc_id": "FIXTURE-POLICY-001",
        "block_id": "b-002",
        "block_path": "ch1/s1",
        "clause_ref": null,
        "page_hint": 2,
        "excerpt": "脱敏占位文本-0005"
      },
      "original_text": "脱敏占位文本-0111",
      "disposition": "definition",
      "clause_types": [
        "definition"
      ],
      "applicable_subjects": [
        "脱敏占位文本-0112"
      ],
      "trigger": null,
      "requirement": "脱敏占位文本-0113",
      "responsible_roles": [
        "脱敏占位文本-0112"
      ],
      "parameters": [],
      "evidence_requirements": [
        "脱敏占位文本-0114"
      ],
      "exception_note": null,
      "operationalized_by": [
        "PE-L3-01",
        "PE-L3-02"
      ],
      "semantic_confidence": 0.9,
      "uncertainty_reason": null,
      "review": {
        "status": "proposed",
        "pool": "sampled"
      },
      "candidate_refs": [
        "CAND-R-01"
      ]
    },
    {
      "rule_id": "R-02",
      "source": {
        "doc_id": "FIXTURE-POLICY-001",
        "block_id": "b-009",
        "block_path": "ch2/s1",
        "clause_ref": null,
        "page_hint": 2,
        "excerpt": "脱敏占位文本-0012"
      },
      "original_text": "脱敏占位文本-0115",
      "disposition": "mandatory",
      "clause_types": [
        "mandatory"
      ],
      "applicable_subjects": [
        "脱敏占位文本-0112",
        "脱敏占位文本-0082"
      ],
      "trigger": "脱敏占位文本-0116",
      "requirement": "脱敏占位文本-0117",
      "responsible_roles": [
        "脱敏占位文本-0082"
      ],
      "parameters": [
        {
          "name": "脱敏占位文本-0118",
          "value": "脱敏占位文本-0119",
          "unit": "脱敏占位文本-0120",
          "parameterType": "quota"
        }
      ],
      "evidence_requirements": [
        "脱敏占位文本-0121"
      ],
      "exception_note": "脱敏占位文本-0122",
      "operationalized_by": [
        "PE-L3-01",
        "PE-L3-02"
      ],
      "semantic_confidence": 0.7,
      "uncertainty_reason": "脱敏占位文本-0123",
      "review": {
        "status": "proposed",
        "pool": "full"
      },
      "candidate_refs": [
        "CAND-R-02"
      ]
    },
    {
      "rule_id": "R-03",
      "source": {
        "doc_id": "FIXTURE-POLICY-001",
        "block_id": "b-010",
        "block_path": "ch2/s2",
        "clause_ref": null,
        "page_hint": 3,
        "excerpt": "脱敏占位文本-0013"
      },
      "original_text": "脱敏占位文本-0124",
      "disposition": "mandatory",
      "clause_types": [
        "mandatory"
      ],
      "applicable_subjects": [
        "脱敏占位文本-0112"
      ],
      "trigger": "脱敏占位文本-0116",
      "requirement": "脱敏占位文本-0125",
      "responsible_roles": [
        "脱敏占位文本-0112"
      ],
      "parameters": [
        {
          "name": "脱敏占位文本-0096",
          "value": "脱敏占位文本-0126",
          "unit": "脱敏占位文本-0127",
          "parameterType": "duration"
        }
      ],
      "evidence_requirements": [
        "脱敏占位文本-0128"
      ],
      "exception_note": "脱敏占位文本-0129",
      "operationalized_by": [
        "PE-L3-01",
        "PE-L3-02"
      ],
      "semantic_confidence": 0.7,
      "uncertainty_reason": "脱敏占位文本-0130",
      "review": {
        "status": "proposed",
        "pool": "full"
      },
      "candidate_refs": [
        "CAND-R-03"
      ]
    },
    {
      "rule_id": "R-04",
      "source": {
        "doc_id": "FIXTURE-POLICY-001",
        "block_id": "b-012",
        "block_path": "ch3/s1",
        "clause_ref": null,
        "page_hint": 3,
        "excerpt": "脱敏占位文本-0015"
      },
      "original_text": "脱敏占位文本-0131",
      "disposition": "procedural",
      "clause_types": [
        "procedural"
      ],
      "applicable_subjects": [
        "脱敏占位文本-0112"
      ],
      "trigger": "脱敏占位文本-0132",
      "requirement": "脱敏占位文本-0133",
      "responsible_roles": [
        "脱敏占位文本-0112"
      ],
      "parameters": [],
      "evidence_requirements": [
        "脱敏占位文本-0134",
        "脱敏占位文本-0135"
      ],
      "exception_note": null,
      "operationalized_by": [
        "PE-L4-01"
      ],
      "semantic_confidence": 0.9,
      "uncertainty_reason": null,
      "review": {
        "status": "proposed",
        "pool": "sampled"
      },
      "candidate_refs": [
        "CAND-R-04"
      ]
    },
    {
      "rule_id": "R-05",
      "source": {
        "doc_id": "FIXTURE-POLICY-001",
        "block_id": "b-013",
        "block_path": "ch3/s1/ct/sales",
        "clause_ref": null,
        "page_hint": 3,
        "excerpt": "脱敏占位文本-0016"
      },
      "original_text": "脱敏占位文本-0136",
      "disposition": "procedural",
      "clause_types": [
        "procedural"
      ],
      "applicable_subjects": [
        "脱敏占位文本-0112",
        "脱敏占位文本-0080",
        "脱敏占位文本-0081",
        "脱敏占位文本-0082",
        "脱敏占位文本-0083",
        "脱敏占位文本-0084"
      ],
      "trigger": "脱敏占位文本-0137",
      "requirement": "脱敏占位文本-0138",
      "responsible_roles": [
        "脱敏占位文本-0080",
        "脱敏占位文本-0081",
        "脱敏占位文本-0082",
        "脱敏占位文本-0083",
        "脱敏占位文本-0084"
      ],
      "parameters": [],
      "evidence_requirements": [
        "脱敏占位文本-0139"
      ],
      "exception_note": "脱敏占位文本-0140",
      "operationalized_by": [
        "PE-L4-02",
        "PE-L4-03",
        "PE-L4-04",
        "PE-L4-05"
      ],
      "semantic_confidence": 0.85,
      "uncertainty_reason": null,
      "review": {
        "status": "proposed",
        "pool": "sampled"
      },
      "candidate_refs": [
        "CAND-R-05"
      ]
    },
    {
      "rule_id": "R-06",
      "source": {
        "doc_id": "FIXTURE-POLICY-001",
        "block_id": "b-020",
        "block_path": "ch3/s1/note3",
        "clause_ref": null,
        "page_hint": 4,
        "excerpt": "脱敏占位文本-0023"
      },
      "original_text": "脱敏占位文本-0141",
      "disposition": "mandatory",
      "clause_types": [
        "mandatory"
      ],
      "applicable_subjects": [
        "脱敏占位文本-0142",
        "脱敏占位文本-0143",
        "脱敏占位文本-0144"
      ],
      "trigger": "脱敏占位文本-0145",
      "requirement": "脱敏占位文本-0146",
      "responsible_roles": [
        "脱敏占位文本-0142",
        "脱敏占位文本-0143",
        "脱敏占位文本-0144"
      ],
      "parameters": [
        {
          "name": "脱敏占位文本-0147",
          "value": "脱敏占位文本-0148",
          "unit": "脱敏占位文本-0149",
          "comparator": "LT",
          "parameterType": "amount_threshold",
          "valueNumber": 5000000
        },
        {
          "name": "脱敏占位文本-0150",
          "value": "脱敏占位文本-0151",
          "unit": "脱敏占位文本-0149",
          "comparator": "GE",
          "parameterType": "amount_threshold",
          "valueNumber": 10000000
        }
      ],
      "evidence_requirements": [
        "脱敏占位文本-0152"
      ],
      "exception_note": "脱敏占位文本-0153",
      "operationalized_by": [
        "PE-L4-05"
      ],
      "semantic_confidence": 0.8,
      "uncertainty_reason": "脱敏占位文本-0154",
      "review": {
        "status": "proposed",
        "pool": "full"
      },
      "candidate_refs": [
        "CAND-R-06"
      ]
    },
    {
      "rule_id": "R-07",
      "source": {
        "doc_id": "FIXTURE-POLICY-001",
        "block_id": "b-028",
        "block_path": "ch4/s1",
        "clause_ref": null,
        "page_hint": 5,
        "excerpt": "脱敏占位文本-0031"
      },
      "original_text": "脱敏占位文本-0155",
      "disposition": "mandatory",
      "clause_types": [
        "mandatory"
      ],
      "applicable_subjects": [
        "脱敏占位文本-0112"
      ],
      "trigger": "脱敏占位文本-0156",
      "requirement": "脱敏占位文本-0157",
      "responsible_roles": [
        "脱敏占位文本-0112"
      ],
      "parameters": [],
      "evidence_requirements": [
        "脱敏占位文本-0098"
      ],
      "exception_note": "脱敏占位文本-0158",
      "operationalized_by": [
        "PE-L5-02"
      ],
      "semantic_confidence": 0.9,
      "uncertainty_reason": null,
      "review": {
        "status": "proposed",
        "pool": "sampled"
      },
      "candidate_refs": [
        "CAND-R-07"
      ]
    },
    {
      "rule_id": "R-08",
      "source": {